formal_object,physics_role,ontological_question
psi,quantum state or wavefunction,Is it physically real epistemic relational or operational
H_hat,Hamiltonian operator,Does it represent energy structure dynamical law or model generator
g_mu_nu,metric tensor,Is spacetime geometry physical relational or representational
A_mu,gauge potential,Which parts are physical and which are redundant
F_mu_nu,field strength tensor,Does invariant field structure identify physical content
rho,density matrix,Does it represent state knowledge subsystem state or ensemble
S,action functional,Is variational structure fundamental calculational or explanatory
