source,organization,primary_role,url
MIT Statistical Mechanics I,MIT OpenCourseWare,graduate statistical mechanics course,https://ocw.mit.edu/courses/8-333-statistical-mechanics-i-statistical-mechanics-of-particles-fall-2013/
MIT Statistical Mechanics I Lecture Notes,MIT OpenCourseWare,thermodynamics probability kinetic theory classical and quantum statistical mechanics,https://ocw.mit.edu/courses/8-333-statistical-mechanics-i-statistical-mechanics-of-particles-fall-2013/pages/lecture-notes/
NIST Boltzmann Constant,NIST,exact Boltzmann constant value,https://physics.nist.gov/cgi-bin/cuu/Value?k=
NIST Essential Statistical Thermodynamics,NIST,statistical thermodynamics reference,https://cccbdb.nist.gov/thermox.asp
Boltzmann 1877 Translation,Entropy journal,entropy probability and thermal equilibrium translation,https://www.mdpi.com/1099-4300/17/4/1971
Gibbs 1902,Internet Archive,foundational statistical mechanics text,https://archive.org/details/elementaryprinci00gibbrich
Perrin Brownian Movement,Internet Archive,Brownian motion and molecular reality,https://ia601405.us.archive.org/15/items/in.ernet.dli.2015.212491/2015.212491.Brownian-Movement_text.pdf
