domain,physics_foundation,example_system,measurement_dependency
semiconductors,quantum mechanics and solid-state physics,microprocessor,dimensional and electrical metrology
photonics,electromagnetism and optics,fiber optic communication,optical power and alignment
navigation,relativity timing and signal propagation,GPS receiver,clock synchronization
medical imaging,radiation magnetism acoustics detectors,MRI CT PET ultrasound,calibration and dose measurement
energy,thermodynamics electromagnetism nuclear physics,power grid and generation,efficiency and power quality
space systems,orbital mechanics radiation detectors,satellite instruments,radiometry and timing
advanced materials,condensed matter and materials physics,batteries superconductors sensors,materials characterization
