source,organization,primary_role,url
BIPM SI Brochure,BIPM,official SI unit framework,https://www.bipm.org/en/si-brochure-9
BIPM kelvin mise en pratique,BIPM,kelvin definition realization guidance,https://www.bipm.org/documents/20126/41489682/SI-App2-kelvin.pdf
BIPM kelvin base unit,BIPM,kelvin base unit definition,https://www.bipm.org/en/si-base-units/kelvin
NIST Boltzmann constant,NIST,exact Boltzmann constant value,https://physics.nist.gov/cgi-bin/cuu/Value?k=
NIST Kelvin thermodynamic temperature,NIST,kelvin redefinition explanation,https://www.nist.gov/si-redefinition/kelvin/kelvin-thermodynamic-temperature
MIT Thermodynamics and Kinetics,MIT OpenCourseWare,equilibrium thermodynamics and kinetics course,https://ocw.mit.edu/courses/5-60-thermodynamics-kinetics-spring-2008/
Carnot Reflections,University of Pittsburgh,foundational heat-engine text,https://sites.pitt.edu/~jdnorton/teaching/2559_Therm_Stat_Mech/docs/Carnot%20Reflections%201897%20facsimile.pdf
Clausius Mechanical Theory of Heat,Internet Archive,mechanical theory of heat source text,https://ia601306.us.archive.org/8/items/cu31924101120883/cu31924101120883.pdf
Maxwell Theory of Heat,Internet Archive,classical thermodynamics text,https://dn721704.ca.archive.org/0/items/theoryofheat00maxwuoft/theoryofheat00maxwuoft.pdf
